{
  "schema_version": "race-history.v1",
  "generated_at": "2026-06-21T23:59:00+09:00",
  "source": {
    "kind": "site-static-copy",
    "canonical_inputs": [
      "runs/<race_id>/pack-v1.json",
      "runs/<race_id>/result.json",
      "runs/<race_id>/predictions/v1/*.json",
      "runs/<race_id>/predictions/aggregated-v1.json",
      "data/scoring/<race_id>.json"
    ],
    "note": "サイト表示用の静的スナップショット。将来DB化するまでは site/data 配下のこのコピーをAPIが読む。"
  },
  "races": [
    {
      "id": "202609030411",
      "race_id": "202609030411",
      "name": "第67回宝塚記念",
      "race_name": "第67回宝塚記念",
      "grade": "G1",
      "date": "2026-06-14",
      "post_time": "15:40",
      "course": "阪神・芝2200m・内回り・良",
      "course_detail": {
        "track": "阪神",
        "surface": "芝",
        "distance": 2200,
        "direction": "右",
        "inner_outer": "内"
      },
      "weather": {
        "forecast": "曇時々晴",
        "track_condition_forecast": "良（前日時点予報。梅雨入り後のため当日変動注意）"
      },
      "sampleLabel": "n=1 / 初回ライブ運用",
      "sample_label": "n=1 / 初回ライブ運用",
      "horses": {
        "1": "ダノンデサイル",
        "2": "ミュージアムマイル",
        "3": "シュガークン",
        "4": "ミクニインスパイア",
        "5": "クロワデュノール",
        "6": "ビザンチンドリーム",
        "7": "ファミリータイム",
        "8": "タガノデュード",
        "9": "コスモキュランダ",
        "10": "ジューンテイク",
        "11": "シンエンペラー",
        "12": "マイネルエンペラー",
        "13": "シェイクユアハート",
        "14": "スティンガーグラス",
        "15": "マイユニバース",
        "16": "メイショウタバル",
        "17": "レガレイラ",
        "18": "ミステリーウェイ"
      },
      "horse_list": [
        {
          "horse_num": 1,
          "name": "ダノンデサイル",
          "gate": 1,
          "jockey": "戸崎圭太",
          "trainer": "安田翔伍",
          "odds_win": 10
        },
        {
          "horse_num": 2,
          "name": "ミュージアムマイル",
          "gate": 1,
          "jockey": "D.レーン",
          "trainer": "高柳大輔",
          "odds_win": 4.5
        },
        {
          "horse_num": 3,
          "name": "シュガークン",
          "gate": 2,
          "jockey": "吉村誠之助",
          "trainer": "清水久詞",
          "odds_win": 101
        },
        {
          "horse_num": 4,
          "name": "ミクニインスパイア",
          "gate": 2,
          "jockey": "丹内祐次",
          "trainer": "林徹",
          "odds_win": 26
        },
        {
          "horse_num": 5,
          "name": "クロワデュノール",
          "gate": 3,
          "jockey": "北村友一",
          "trainer": "斉藤崇史",
          "odds_win": 2.4
        },
        {
          "horse_num": 6,
          "name": "ビザンチンドリーム",
          "gate": 3,
          "jockey": "西村淳也",
          "trainer": "坂口智康",
          "odds_win": 15
        },
        {
          "horse_num": 7,
          "name": "ファミリータイム",
          "gate": 4,
          "jockey": "幸英明",
          "trainer": "石坂公一",
          "odds_win": 71
        },
        {
          "horse_num": 8,
          "name": "タガノデュード",
          "gate": 4,
          "jockey": "高杉吏麒",
          "trainer": "宮徹",
          "odds_win": 101
        },
        {
          "horse_num": 9,
          "name": "コスモキュランダ",
          "gate": 5,
          "jockey": "横山武史",
          "trainer": "加藤士津八",
          "odds_win": 41
        },
        {
          "horse_num": 10,
          "name": "ジューンテイク",
          "gate": 5,
          "jockey": "松山弘平",
          "trainer": "武英智",
          "odds_win": 41
        },
        {
          "horse_num": 11,
          "name": "シンエンペラー",
          "gate": 6,
          "jockey": "坂井瑠星",
          "trainer": "矢作芳人",
          "odds_win": 101
        },
        {
          "horse_num": 12,
          "name": "マイネルエンペラー",
          "gate": 6,
          "jockey": "川田将雅",
          "trainer": "清水久詞",
          "odds_win": 51
        },
        {
          "horse_num": 13,
          "name": "シェイクユアハート",
          "gate": 7,
          "jockey": "古川吉洋",
          "trainer": "宮徹",
          "odds_win": 41
        },
        {
          "horse_num": 14,
          "name": "スティンガーグラス",
          "gate": 7,
          "jockey": "岩田望来",
          "trainer": "友道康夫",
          "odds_win": 31
        },
        {
          "horse_num": 15,
          "name": "マイユニバース",
          "gate": 7,
          "jockey": "横山典弘",
          "trainer": "武幸四郎",
          "odds_win": 15
        },
        {
          "horse_num": 16,
          "name": "メイショウタバル",
          "gate": 8,
          "jockey": "武豊",
          "trainer": "石橋守",
          "odds_win": 6
        },
        {
          "horse_num": 17,
          "name": "レガレイラ",
          "gate": 8,
          "jockey": "C.ルメール",
          "trainer": "木村哲也",
          "odds_win": 9
        },
        {
          "horse_num": 18,
          "name": "ミステリーウェイ",
          "gate": 8,
          "jockey": "松本大輝",
          "trainer": "小林真也",
          "odds_win": 151
        }
      ],
      "result": {
        "winner": 16,
        "place3": [
          16,
          5,
          1
        ],
        "finish_order_known": [
          16,
          5,
          1
        ],
        "finish_order_complete": false,
        "popularity": {
          "1": 3,
          "5": 1,
          "16": 2
        },
        "payouts": {
          "tansho": {
            "16": 390
          },
          "fukusho": {
            "1": 170,
            "5": 120,
            "16": 140
          },
          "wakuren": {
            "3-8": 380
          },
          "umaren": {
            "5-16": 620
          },
          "umatan": {
            "16-5": 1360
          },
          "wide": {
            "5-16": 260,
            "1-16": 490,
            "1-5": 290
          },
          "sanrenpuku": {
            "1-5-16": 1230
          },
          "sanrentan": {
            "16-5-1": 6040
          }
        },
        "source": "JRA確定（payout スクリーンショット 2026-06-14）",
        "note": "4着以下は未取得。採点は1着(win)と3着内(place)に基づく。完全着順が取れたら RPS / Spearman を追加可能。",
        "payout_list": [
          {
            "bet_type": "単勝",
            "selection": "16",
            "selection_horses": [
              16
            ],
            "selection_label": "16 メイショウタバル",
            "payout_per_100": 390,
            "popularity": 2
          },
          {
            "bet_type": "複勝",
            "selection": "1",
            "selection_horses": [
              1
            ],
            "selection_label": "1 ダノンデサイル",
            "payout_per_100": 170,
            "popularity": 3
          },
          {
            "bet_type": "複勝",
            "selection": "5",
            "selection_horses": [
              5
            ],
            "selection_label": "5 クロワデュノール",
            "payout_per_100": 120,
            "popularity": 1
          },
          {
            "bet_type": "複勝",
            "selection": "16",
            "selection_horses": [
              16
            ],
            "selection_label": "16 メイショウタバル",
            "payout_per_100": 140,
            "popularity": 2
          },
          {
            "bet_type": "枠連",
            "selection": "3-8",
            "selection_horses": [],
            "selection_label": "3-8",
            "payout_per_100": 380,
            "popularity": null
          },
          {
            "bet_type": "馬連",
            "selection": "5-16",
            "selection_horses": [
              5,
              16
            ],
            "selection_label": "5 クロワデュノール - 16 メイショウタバル",
            "payout_per_100": 620,
            "popularity": null
          },
          {
            "bet_type": "馬単",
            "selection": "16-5",
            "selection_horses": [
              16,
              5
            ],
            "selection_label": "16 メイショウタバル → 5 クロワデュノール",
            "payout_per_100": 1360,
            "popularity": null
          },
          {
            "bet_type": "ワイド",
            "selection": "5-16",
            "selection_horses": [
              5,
              16
            ],
            "selection_label": "5 クロワデュノール - 16 メイショウタバル",
            "payout_per_100": 260,
            "popularity": null
          },
          {
            "bet_type": "ワイド",
            "selection": "1-16",
            "selection_horses": [
              1,
              16
            ],
            "selection_label": "1 ダノンデサイル - 16 メイショウタバル",
            "payout_per_100": 490,
            "popularity": null
          },
          {
            "bet_type": "ワイド",
            "selection": "1-5",
            "selection_horses": [
              1,
              5
            ],
            "selection_label": "1 ダノンデサイル - 5 クロワデュノール",
            "payout_per_100": 290,
            "popularity": null
          },
          {
            "bet_type": "三連複",
            "selection": "1-5-16",
            "selection_horses": [
              1,
              5,
              16
            ],
            "selection_label": "1 ダノンデサイル - 5 クロワデュノール - 16 メイショウタバル",
            "payout_per_100": 1230,
            "popularity": null
          },
          {
            "bet_type": "三連単",
            "selection": "16-5-1",
            "selection_horses": [
              16,
              5,
              1
            ],
            "selection_label": "16 メイショウタバル → 5 クロワデュノール → 1 ダノンデサイル",
            "payout_per_100": 6040,
            "popularity": null
          }
        ]
      },
      "betting": {
        "investment_jpy": 3000,
        "payout_jpy": 5150,
        "profit_jpy": 2150,
        "roi_percent": 171.7,
        "hit_tickets": 4,
        "total_tickets": 11,
        "source_files": [
          "runs/202609030411/betting-v2.md",
          "runs/202609030411/result-v1.md",
          "runs/202609030411/result.json"
        ],
        "tickets": [
          {
            "bet_type": "複勝",
            "selection": "16",
            "selection_horses": [
              16
            ],
            "selection_label": "16 メイショウタバル",
            "stake_jpy": 400,
            "hit": true,
            "result": "hit",